{
  "id": "TICKET-TEST-039",
  "story": "STORY-049",
  "implementation_ticket": "TICKET-IMPL-039",
  "status": "done",
  "fix_summary": {
    "problem_and_root_cause": "Uusi ominaisuus. Koko sarja löysi oman virheen: neuvonantajarivi käytti luokkaa city-hint, jolloin kasvutestin haku osui kahteen elementtiin. Rivi sai oman luokan. Vartijan vastaus siirrettiin rosvokortin näyttökohtaan, koska päivän ulkopuolella alkanut ryöstö ehti muuten näyttää kortin.",
    "files_changed": [
      "src/ui/cityCard.ts",
      "src/ui/hud.css",
      "src/globe/main.ts"
    ]
  },
  "ai_testing": {
    "environment": "Vitest ja Playwright paikallisesti; GitHub Actions.",
    "tooling": "Vitest 5.0.3, Playwright 1.64.0",
    "cases": [
      {
        "steps": "Yksikkö: neuvonantajien säännöt ja kartoituskohde",
        "expected": "Oma ohjaus ei tee mitään; Kasvattaja, Vartija ja Kartoittaja kuten kriteereissä",
        "result": "pass",
        "outcome": "pass"
      },
      {
        "steps": "E2E: neuvonantajat",
        "expected": "Kortissa neljä vaihtoehtoa; Kartoittaja ohjaa tiedustelijat; Vartija tuotanto-painotus, vastaa rosvoihin ilman korttia; kaupunkikortin rivi",
        "result": "pass (advisors.png, city-advisor.png)",
        "outcome": "pass"
      },
      {
        "steps": "Puhelinleveys 390 px",
        "expected": "Yläpaneeli mahtuu, kortti luettava",
        "result": "pass (kuvakaappaus; päivän numero korjattu yhdelle riville)",
        "outcome": "pass"
      },
      {
        "steps": "Kaikki testit",
        "expected": "Vihreä",
        "result": "Yksikkötestit 146/146; E2E 60/60",
        "outcome": "pass"
      },
      {
        "steps": "CI-ajo",
        "expected": "Vihreä ja julkaisu",
        "result": "Ajo 38345953433 (13d5793, 27 min; sama ajo kattaa STORY-047–051:n) vihreä ja julkaistu. Ensimmäinen ajo 38344474619 (13d5793) oli punainen: löytökortin puhelintesti luki kortin paikan ennen kuin kortti näkyi; testi korjattiin odottamaan korttia (d3da866, ajo 38347966977 vihreä)",
        "outcome": "pass"
      },
      {
        "steps": "Samin pelitesti",
        "expected": "Neuvonantaja vähentää mikromanagerointia",
        "result": "Ei ajettu — Samin kokeiltavaksi.",
        "outcome": "not_run"
      }
    ],
    "console_findings": [],
    "screenshots": []
  },
  "human_acceptance": {
    "checked_items": [
      {
        "item": "Neljä vaihtoehtoa",
        "checked": true
      },
      {
        "item": "Päivittäiset toimet",
        "checked": true
      },
      {
        "item": "Rosvokortin vastaus",
        "checked": true
      },
      {
        "item": "Tallennus",
        "checked": true
      }
    ],
    "decision": "accepted",
    "signed_by": "Linssi (Samin valtuutuksella)",
    "date": "2026-10-13"
  }
}
